<?xml version="1.0"?>
<molsimInput xmlns:xsi="http://www.w3.org/2001/XMLSchema-instance"
       xsi:noNamespaceSchemaLocation="molsimInput.xsd">
   <!-- <name_output>Name of </name_output> -->
    <!-- <frequency_output>10</frequency_output> -->
    <delta_t>0.01</delta_t>
    <t_end>2</t_end>
    <particles>
        <particles>
            <particle>
                <coordinates>
                    <x>1</x>
                    <y>2</y>
                    <z>3</z>
                </coordinates>
                <velocity>
                    <x>2.1</x>
                    <y>3.1</y>
                    <z>4.1</z>
                </velocity>
                <mass>1.27</mass>
            </particle>
        </particles>
    </particles>
</molsimInput>
