<?xml version="1.0"?>
<molsimInput xmlns:xsi="http://www.w3.org/2001/XMLSchema-instance"
       xsi:noNamespaceSchemaLocation="molsimInput.xsd">
   <!-- <name_output>Name of </name_output> -->
    <!-- <frequency_output>10</frequency_output> -->
    <delta_t>0.01</delta_t>
    <t_end>2</t_end>
    <particles>
        <cuboids>
            <cuboid>
                <coordinates>
                    <x>1</x>
                    <y>2</y>
                    <z>3</z>
                </coordinates>
                <particles_per_dimension>
                    <x>4</x>
                    <y>5</y>
                    <z>6</z>
                </particles_per_dimension>
                <distance_particles>0.1</distance_particles>
                <mass>0.5</mass>
                <velocity>
                    <x>1.1</x>
                    <y>2.2</y>
                    <z>3.3</z>
                </velocity>
            </cuboid>
        </cuboids>
    </particles>
</molsimInput>
